<?xml version="1.0" encoding="UTF-8"?>
<questionnaire
    xmlns="http://www.example.com/questionnaire"
    xmlns:xsi="http://www.w3.org/2001/XMLSchema-instance"
    xsi:schemaLocation="http://www.example.com/questionnaire xmlToSchema.xsd"
    version="1.0"
    comapny="BigNameCo"
    >
    <participant ID="0000001">
            <name title="Mrs.">
                <first>Elizabeth</first>
                <middle>K.</middle>
                <last>Stevenson</last>
            </name>
            <sex>female</sex>
            <DOB>1964-08-24</DOB>
            <maritalStatus>married</maritalStatus>
            <religion>Pastafarian</religion>
            <phone kind="Home">294-867-7723</phone>
            <phone kind="Work">573-193-5839</phone>
            <socSec>11-111-1111</socSec>
    </participant>
    <participant ID="0000002">
            <name title="Mr.">
                <first>Jake</first>
                <middle>V.</middle>
                <last>Whitman</last>
            </name>
            <sex>male</sex>
            <DOB>1962-03-19</DOB>
            <maritalStatus>undisclosed</maritalStatus>
            <religion>Agnostic</religion>
            <phone kind="Home">930-496-1252</phone>
            <phone kind="Mobile">694-293-9927</phone>
            <socSec>22-222-2222</socSec>
    </participant>
    <participant ID="0000003">
        <name title="Ms.">
            <first>Nancy</first>
            <middle>Reanne</middle>
            <last>Patterson</last>
        </name>
        <sex>female</sex>
        <DOB>1942-05-03</DOB>
        <maritalStatus>widowed</maritalStatus>
        <religion>Catholic</religion>
        <phone kind="Home">210-864-2479</phone>
        <phone kind="Fax">285-729-1937</phone>
        <socSec>33-333-3333</socSec>
    </participant>
</questionnaire>
